{
  "schema_id": "ecai/terminal_item/1.0",
  "run_id": "11111111-1111-4111-8111-111111111111",
  "produced_at": "2026-09-15T22:17:00Z",
  "provenance": {
    "stage": "TERMINAL",
    "persona": null,
    "model_id": null,
    "input_artifact_hashes": [
      "ffffffffffffffffffffffffffffffffffffffffffffffffffffffffffffffff"
    ]
  },
  "game_key": "Away@Home 2026-09-15",
  "terminal_status": "ACTIVE",
  "direction": "HOME",
  "provenance_chain": {
    "binding_ref": "2f1fce46ca66219a0349a372052721a47f00d515fffa20bdb5cc3d4d3fc3ae4c",
    "framing_ref": "aaaaaaaaaaaaaaaaaaaaaaaaaaaaaaaaaaaaaaaaaaaaaaaaaaaaaaaaaaaaaaaa",
    "det_output_ref": "eeeeeeeeeeeeeeeeeeeeeeeeeeeeeeeeeeeeeeeeeeeeeeeeeeeeeeeeeeeeeeee",
    "analyst_verdict_refs": [
      "1111111111111111111111111111111111111111111111111111111111111111",
      "2222222222222222222222222222222222222222222222222222222222222222",
      "3333333333333333333333333333333333333333333333333333333333333333"
    ],
    "convergence_ref": "cccccccccccccccccccccccccccccccccccccccccccccccccccccccccccccccc",
    "curator_ref": "dddddddddddddddddddddddddddddddddddddddddddddddddddddddddddddddd",
    "gatekeeper_ref": "bbbbbbbbbbbbbbbbbbbbbbbbbbbbbbbbbbbbbbbbbbbbbbbbbbbbbbbbbbbbbbbb"
  },
  "display": {
    "line": "Away@Home 2026-09-15 | HOME | ACTIVE",
    "rank_tuple": "(line_value=-130, valid_analysts=3, agreement_index=0.67)"
  }
}
